{
  "$schema": "https://json-schema.org/draft/2020-12/schema",
  "$id": "https://schemas.esquilospeak.com/content/lesson.schema.json",
  "title": "Lesson authoring source",
  "description": "Content-as-code lesson. Answer policy and feedback are authoring-only and are removed from learner preview/delivery.",
  "type": "object",
  "required": [
    "id",
    "courseId",
    "courseVersion",
    "unitId",
    "position",
    "locale",
    "requiredLocales",
    "title",
    "objectives",
    "outcomeIds",
    "prerequisiteLessonIds",
    "difficulty",
    "estimatedMinutes",
    "exercises"
  ],
  "properties": {
    "id": { "$ref": "common.schema.json#/$defs/identifier" },
    "courseId": { "$ref": "common.schema.json#/$defs/identifier" },
    "courseVersion": { "type": "integer", "minimum": 1 },
    "unitId": { "$ref": "common.schema.json#/$defs/identifier" },
    "position": { "type": "integer", "minimum": 1 },
    "locale": { "$ref": "common.schema.json#/$defs/locale" },
    "requiredLocales": {
      "type": "array",
      "items": { "$ref": "common.schema.json#/$defs/locale" },
      "minItems": 1,
      "uniqueItems": true
    },
    "title": { "$ref": "common.schema.json#/$defs/localizedText" },
    "objectives": {
      "type": "array",
      "items": { "$ref": "common.schema.json#/$defs/localizedText" },
      "minItems": 1
    },
    "outcomeIds": {
      "type": "array",
      "items": { "$ref": "common.schema.json#/$defs/identifier" },
      "minItems": 1,
      "uniqueItems": true
    },
    "prerequisiteLessonIds": {
      "type": "array",
      "items": { "$ref": "common.schema.json#/$defs/identifier" },
      "uniqueItems": true
    },
    "revisitsConceptIds": {
      "type": "array",
      "items": { "$ref": "common.schema.json#/$defs/identifier" },
      "uniqueItems": true
    },
    "difficulty": { "$ref": "common.schema.json#/$defs/difficulty" },
    "estimatedMinutes": { "type": "integer", "minimum": 1, "maximum": 120 },
    "exercises": {
      "type": "array",
      "items": {
        "$ref": "#/$defs/exerciseV2"
      },
      "minItems": 1
    },
    "advancedActivities": {
      "type": "array",
      "items": { "$ref": "lesson-delivery.schema.json#/$defs/advancedActivity" },
      "uniqueItems": true
    }
  },
  "additionalProperties": false,
  "$defs": {
    "exerciseV2": {
      "type": "object",
      "required": ["id", "type", "learningItem", "presentation", "answerPolicy", "feedbackRule"],
      "properties": {
        "id": { "$ref": "common.schema.json#/$defs/identifier" },
        "type": {
          "enum": [
            "multiple_choice", "true_false", "flashcard", "matching",
            "listen_select", "ordering", "fill_blank", "dictation", "comprehension"
          ]
        },
        "learningItem": { "$ref": "#/$defs/learningItem" },
        "presentation": {
          "type": "object",
          "required": ["prompt", "hint", "mediaIds", "accessibility"],
          "properties": {
            "prompt": { "$ref": "common.schema.json#/$defs/localizedText" },
            "instruction": { "$ref": "common.schema.json#/$defs/localizedText" },
            "hint": { "$ref": "common.schema.json#/$defs/localizedText" },
            "transcript": { "$ref": "common.schema.json#/$defs/localizedText" },
            "mediaIds": {
              "type": "array",
              "items": { "$ref": "common.schema.json#/$defs/identifier" },
              "uniqueItems": true
            },
            "accessibility": { "$ref": "common.schema.json#/$defs/accessibilityMetadata" },
            "options": {
              "type": "array",
              "items": { "$ref": "#/$defs/exerciseOption" },
              "minItems": 2
            },
            "items": {
              "type": "array",
              "items": { "$ref": "#/$defs/exerciseOption" },
              "minItems": 2
            },
            "leftItems": {
              "type": "array",
              "items": { "$ref": "#/$defs/exerciseOption" },
              "minItems": 2
            },
            "rightItems": {
              "type": "array",
              "items": { "$ref": "#/$defs/exerciseOption" },
              "minItems": 2
            }
          },
          "additionalProperties": false
        },
        "answerPolicy": {
          "type": "object",
          "required": ["kind", "maxAttempts"],
          "properties": {
            "kind": {
              "enum": ["option_id", "boolean", "self_assessment", "pair_set", "ordered_ids", "normalized_text"]
            },
            "correctOptionId": { "$ref": "common.schema.json#/$defs/identifier" },
            "correctAnswer": { "type": "boolean" },
            "correctPairs": {
              "type": "array",
              "items": {
                "type": "object",
                "required": ["leftId", "rightId"],
                "properties": {
                  "leftId": { "$ref": "common.schema.json#/$defs/identifier" },
                  "rightId": { "$ref": "common.schema.json#/$defs/identifier" }
                },
                "additionalProperties": false
              },
              "minItems": 2
            },
            "correctOrder": {
              "type": "array",
              "items": { "$ref": "common.schema.json#/$defs/identifier" },
              "minItems": 2,
              "uniqueItems": true
            },
            "acceptedAnswers": {
              "type": "array",
              "items": { "type": "string", "minLength": 1 },
              "minItems": 1,
              "uniqueItems": true
            },
            "caseSensitive": { "type": "boolean" },
            "maxAttempts": { "type": "integer", "minimum": 1, "maximum": 5 }
          },
          "additionalProperties": false
        },
        "feedbackRule": { "$ref": "#/$defs/feedbackRule" }
      },
      "additionalProperties": false
    },
    "learningItem": {
      "type": "object",
      "required": ["skill", "conceptIds", "outcomeIds", "prerequisiteConceptIds", "difficulty"],
      "properties": {
        "skill": { "$ref": "common.schema.json#/$defs/skill" },
        "conceptIds": {
          "type": "array",
          "items": { "$ref": "common.schema.json#/$defs/identifier" },
          "minItems": 1,
          "uniqueItems": true
        },
        "outcomeIds": {
          "type": "array",
          "items": { "$ref": "common.schema.json#/$defs/identifier" },
          "minItems": 1,
          "uniqueItems": true
        },
        "prerequisiteConceptIds": {
          "type": "array",
          "items": { "$ref": "common.schema.json#/$defs/identifier" },
          "uniqueItems": true
        },
        "difficulty": { "$ref": "common.schema.json#/$defs/difficulty" }
      },
      "additionalProperties": false
    },
    "presentationBase": {
      "type": "object",
      "required": ["prompt", "hint", "mediaIds", "accessibility"],
      "properties": {
        "prompt": { "$ref": "common.schema.json#/$defs/localizedText" },
        "instruction": { "$ref": "common.schema.json#/$defs/localizedText" },
        "hint": { "$ref": "common.schema.json#/$defs/localizedText" },
        "mediaIds": {
          "type": "array",
          "items": { "$ref": "common.schema.json#/$defs/identifier" },
          "uniqueItems": true
        },
        "accessibility": { "$ref": "common.schema.json#/$defs/accessibilityMetadata" }
      }
    },
    "feedbackRule": {
      "type": "object",
      "required": ["correct", "incorrect", "explanation", "hintPolicy"],
      "properties": {
        "correct": { "$ref": "common.schema.json#/$defs/localizedText" },
        "incorrect": { "$ref": "common.schema.json#/$defs/localizedText" },
        "explanation": { "$ref": "common.schema.json#/$defs/localizedText" },
        "hintPolicy": {
          "type": "object",
          "required": ["revealAfterAttempts", "countsAsAssisted"],
          "properties": {
            "revealAfterAttempts": { "type": "integer", "minimum": 1, "maximum": 5 },
            "countsAsAssisted": { "type": "boolean" }
          },
          "additionalProperties": false
        }
      },
      "additionalProperties": false
    },
    "exerciseOption": {
      "type": "object",
      "required": ["id", "text"],
      "properties": {
        "id": { "$ref": "common.schema.json#/$defs/identifier" },
        "text": { "$ref": "common.schema.json#/$defs/localizedText" },
        "mediaId": { "$ref": "common.schema.json#/$defs/identifier" }
      },
      "additionalProperties": false
    },
    "multipleChoiceExercise": {
      "type": "object",
      "required": ["id", "type", "learningItem", "presentation", "answerPolicy", "feedbackRule"],
      "properties": {
        "id": { "$ref": "common.schema.json#/$defs/identifier" },
        "type": { "const": "multiple_choice" },
        "learningItem": { "$ref": "#/$defs/learningItem" },
        "presentation": {
          "type": "object",
          "allOf": [
            { "$ref": "#/$defs/presentationBase" },
            {
              "type": "object",
              "required": ["options"],
              "properties": {
                "options": {
                  "type": "array",
                  "items": { "$ref": "#/$defs/exerciseOption" },
                  "minItems": 2
                }
              }
            }
          ],
          "unevaluatedProperties": false
        },
        "answerPolicy": {
          "type": "object",
          "required": ["kind", "correctOptionId", "maxAttempts"],
          "properties": {
            "kind": { "const": "option_id" },
            "correctOptionId": { "$ref": "common.schema.json#/$defs/identifier" },
            "maxAttempts": { "type": "integer", "minimum": 1, "maximum": 5 }
          },
          "additionalProperties": false
        },
        "feedbackRule": { "$ref": "#/$defs/feedbackRule" }
      },
      "additionalProperties": false
    },
    "trueFalseExercise": {
      "type": "object",
      "required": ["id", "type", "learningItem", "presentation", "answerPolicy", "feedbackRule"],
      "properties": {
        "id": { "$ref": "common.schema.json#/$defs/identifier" },
        "type": { "const": "true_false" },
        "learningItem": { "$ref": "#/$defs/learningItem" },
        "presentation": {
          "type": "object",
          "allOf": [
            { "$ref": "#/$defs/presentationBase" }
          ],
          "unevaluatedProperties": false
        },
        "answerPolicy": {
          "type": "object",
          "required": ["kind", "correctAnswer", "maxAttempts"],
          "properties": {
            "kind": { "const": "boolean" },
            "correctAnswer": { "type": "boolean" },
            "maxAttempts": { "type": "integer", "minimum": 1, "maximum": 5 }
          },
          "additionalProperties": false
        },
        "feedbackRule": { "$ref": "#/$defs/feedbackRule" }
      },
      "additionalProperties": false
    }
  }
}
